{
  "$schema": "http://json-schema.org/draft-07/schema#",
  "$id": "https://kart.local/schemas/plan.schema.json",
  "title": "PlanEnvelope",
  "type": "object",
  "additionalProperties": false,
  "required": ["plan_id", "query_id", "manifest_id", "root", "nodes"],
  "properties": {
    "plan_id": { "type": "string" },
    "query_id": { "type": "string" },
    "manifest_id": { "type": "string" },
    "root": { "type": "string" },
    "nodes": {
      "type": "array",
      "minItems": 1,
      "items": {
        "type": "object",
        "additionalProperties": false,
        "required": ["id", "op", "inputs"],
        "properties": {
          "id": { "type": "string" },
          "op": {
            "type": "string",
            "enum": [
              "TIME_RANGE_SCAN",
              "ZORDER_RANGE_SCAN",
              "XZ_RANGE_SCAN",
              "TSHAPE_RANGE_SCAN",
              "XZT_RANGE_SCAN",
              "EQUALITY_LOOKUP",
              "FULL_SCAN_CHUNKS",
              "INTERSECT",
              "UNION",
              "DEDUPLICATE",
              "FETCH_TRAJECTORY_CHUNK",
              "EXACT_ST_FILTER",
              "PROJECT_TRAJECTORY_IDS",
              "EXCLUDE_REFERENCE",
              "BATCH_GET_TRAJECTORY",
              "SIMILARITY",
              "TOP_K",
              "RETURN_TRAJECTORY_IDS",
              "CHUNK_META_FILTER"
            ]
          },
          "inputs": {
            "type": "array",
            "items": { "type": "string" }
          },
          "params": { "type": "object" }
        }
      }
    }
  }
}
