{
  "plan_id" : "P_T",
  "query_id" : "q_fixture_001",
  "manifest_id" : "fixture_v1_ready",
  "root" : "n09",
  "nodes" : [ {
    "id" : "n01",
    "op" : "TIME_RANGE_SCAN",
    "inputs" : [ ],
    "params" : {
      "predicate_ref" : "/temporal"
    }
  }, {
    "id" : "n02",
    "op" : "DEDUPLICATE",
    "inputs" : [ "n01" ]
  }, {
    "id" : "n03",
    "op" : "FETCH_TRAJECTORY_CHUNK",
    "inputs" : [ "n02" ]
  }, {
    "id" : "n04",
    "op" : "EXACT_ST_FILTER",
    "inputs" : [ "n03" ],
    "params" : {
      "predicate_refs" : [ "/temporal", "/spatial" ]
    }
  }, {
    "id" : "n05",
    "op" : "PROJECT_TRAJECTORY_IDS",
    "inputs" : [ "n04" ]
  }, {
    "id" : "n06",
    "op" : "EXCLUDE_REFERENCE",
    "inputs" : [ "n05" ],
    "params" : {
      "reference_tid" : 4
    }
  }, {
    "id" : "n07",
    "op" : "BATCH_GET_TRAJECTORY",
    "inputs" : [ "n06" ]
  }, {
    "id" : "n08",
    "op" : "SIMILARITY",
    "inputs" : [ "n07" ],
    "params" : {
      "local_distance" : "EUCLIDEAN",
      "metric" : "DTW",
      "normalization" : "NONE",
      "reference_tid" : 4,
      "scope" : "FULL_TRAJECTORY"
    }
  }, {
    "id" : "n09",
    "op" : "TOP_K",
    "inputs" : [ "n08" ],
    "params" : {
      "k" : 2,
      "tie_breaker" : "TID_ASC"
    }
  } ]
}